<!ELEMENT nombre (#PCDATA)>
<!ELEMENT apellido (#PCDATA)>
<!ELEMENT genero (#PCDATA)>
<!ELEMENT titulo (#PCDATA)>
<!ELEMENT subgenero (#PCDATA)>
<!ELEMENT tituloOriginal (#PCDATA)>
<!ELEMENT autor (nombre,apellido)>
<!ELEMENT libro (titulo,autor,genero,subgenero,tituloOriginal)>
<!ATTLIST libro id ID #REQUIRED>
<!ATTLIST libro genero CDATA #IMPLIED>
<!ATTLIST libro idioma CDATA "Español">
<!ATTLIST libro formato (impreso|digital) "impreso">
<!ATTLIST libro referencia IDREFS #IMPLIED>
<!ELEMENT biblioteca (libro+)>